id,path,text_spt,text_original,ref_normalized,hyp_normalized,wer,sequence_similarity,duration,sentence_checked
64,00000367.wav,"manisini nimagaligini tushunish juda ham qiziq hozirgi etapda menimcha. His qilish, o'qish bilan his qilishni baribir farqi bor. O'sha baribir 600-yillarga qaytib qolishni men ham xohlagan bo'lardim. Katta rahmat.",ma'nisini nimagaligini tushunish judayam qiziq hozirgi etapda men uchun. his qilish. o'qish bilan his qilishni baribir farqi bor. o'sha baribir 600- yillarga qaytib qolishni men ham xohlagan bo'lardim. katta rahmat.,manisini nimagaligini tushunish juda ham qiziq hozirgi etapda menimcha his qilish o'qish bilan his qilishni baribir farqi bor o'sha baribir olti yuzinchi yillarga qaytib qolishni men ham xohlagan bo'lardim katta rahmat,ma'nisini nimagaligini tushunish judayam qiziq hozirgi etapda men uchun his qilish o'qish bilan his qilishni baribir farqi bor o'sha baribir olti yuz- yillarga qaytib qolishni men ham xohlagan bo'lardim katta rahmat,0.1935,0.9607,17.1893125,"ma'nisini nimagaligini tushunish juda ham qiziq hozirgi etapda men uchun. His qilish, o'qish bilan his qilishni baribir farqi bor. O'sha baribir 600-yillarga qaytib qolishni men ham xohlagan bo'lardim. Katta rahmat."
102,00000606.wav,"yangiliklar bu yaxshi, lekin daraxtlarni taqdiri haqida aniq bitta gap aytilmadi. Chunki bu loyiha bo'yicha ekilgan daraxtlar aynan o'sha rekonstruksiya qilinadigan joyga to'g'ri kelgan. Umid qilamiz, endi orqa varotdan eshitgan gaplarimiz","yangiliklar bu yaxshi, lekin daraxtlarni taqdiri haqida aniq bitta gap aytilmadi. Chunki bu loyiha bo'yicha ekilgan daraxtlar aynan o'sha rekonstruksiya qilinadigan joylarga to'g'ri joyga to'g'ri kelib qolgan ekan. Umid qilamiz, endi orqa barotdan eshitgan gaplarimiz",yangiliklar bu yaxshi lekin daraxtlarni taqdiri haqida aniq bitta gap aytilmadi chunki bu loyiha bo'yicha ekilgan daraxtlar aynan o'sha rekonstruksiya qilinadigan joyga to'g'ri kelgan umid qilamiz endi orqa varotdan eshitgan gaplarimiz,yangiliklar bu yaxshi lekin daraxtlarni taqdiri haqida aniq bitta gap aytilmadi chunki bu loyiha bo'yicha ekilgan daraxtlar aynan o'sha rekonstruksiya qilinadigan joylarga to'g'ri joyga to'g'ri kelib qolgan ekan umid qilamiz endi orqa barotdan eshitgan gaplarimiz,0.1935,0.8795,19.9626875,"yangiliklar bu yaxshi, lekin daraxtlarni taqdiri haqida aniq bitta gap aytilmadi. Chunki bu loyiha bo'yicha ekilgan daraxtlar aynan o'sha rekonstruksiya qilinadigan joylarga to'g'ri joyga to'g'ri kelib qolgan ekan. Umid qilamiz, endi orqa varotdan eshitgan gaplarimiz"
768,00005872.wav,"Xalqaro moliyaviy institutlar bilan ishlay olamiz. Endi to'g'risini aytishimiz kerak, tariflarimiz subsidiya qilingan. Jahon bozorida 150 dollardan gaz sotilayotganda, hozirgi kunda aholiga 38 sentdan yetkazib bera olishimiz kerak.","xalqaro moliya institutlari bilan ishlayapmiz. Endi to'g'risini aytishimiz kerak, tariflarimiz subsidiya qilingan. Jahon bozorida 150 dollardan gaz sotilayotganda, hozirgi kunda aholiga 38 sentdan yetkazib bera olmayapmiz.",xalqaro moliyaviy institutlar bilan ishlay olamiz endi to'g'risini aytishimiz kerak tariflarimiz subsidiya qilingan jahon bozorida bir yuz ellik dollardan gaz sotilayotganda hozirgi kunda aholiga o'ttiz sakkiz sentdan yetkazib bera olishimiz kerak,xalqaro moliya institutlari bilan ishlayapmiz endi to'g'risini aytishimiz kerak tariflarimiz subsidiya qilingan jahon bozorida bir yuz ellik dollardan gaz sotilayotganda hozirgi kunda aholiga o'ttiz sakkiz sentdan yetkazib bera olmayapmiz,0.1935,0.833,14.6186875,"xalqaro moliya institutlari bilan ishlayapmiz. Endi to'g'risini aytishimiz kerak, tariflarimiz subsidiya qilingan. Jahon bozorida 150 dollardan gaz sotilayotganda, hozirgi kunda aholiga 38 sentdan yetkazib beryapmiz."
2007,00016038.wav,"Ana shunday keyin o'sha fundament chiqdi va o'shandan keyin o'sha yo'lak chiqdi. Tushuntira oldimmi yo'q? O'sha yo'lak asosi ikki tomonida mana binolar qilindi. Mana Xudoga shukur endi yomon bo'lgani yo'q, lekin","ana shundan keyin o'sha fundament chiqdi, i o'shandan keyin o'sha yo'lak chiqdi. Tushuntira oldimmi yo'qmi? O'sha yo'lak asos ichi ikki tomonida mana binolar qilindi. Vot. Mana Xudoga shukur endi yomon bo'lgani yo'q, lekin",ana shunday keyin o'sha fundament chiqdi va o'shandan keyin o'sha yo'lak chiqdi tushuntira oldimmi yo'q o'sha yo'lak asosi ikki tomonida mana binolar qilindi mana xudoga shukur endi yomon bo'lgani yo'q lekin,ana shundan keyin o'sha fundament chiqdi i o'shandan keyin o'sha yo'lak chiqdi tushuntira oldimmi yo'qmi o'sha yo'lak asos ichi ikki tomonida mana binolar qilindi vot mana xudoga shukur endi yomon bo'lgani yo'q lekin,0.1935,0.2175,13.83,"ana shundan keyin o'sha fundament chiqdi, va o'shandan keyin o'sha yo'lak chiqdi. Tushuntira oldimmi yo'qmi? O'sha yo'lak asosi ikki chet yonida mana binolar qilindi. Vot. Mana Xudoga shukur endi yomon bo'lgani yo'q, lekin"
2178,00017261.wav,"Buni men, konditsioner yoqilgan studiyada turib tushuntirib bera olmayman, ochiqi. Ha, aytgancha, gapning xonasi kelganda aytib olay. 22-iyul kuni Navoiy viloyatining g'arbiy cho'l hududi dunyoning eng issiq nuqtasiga aylandi.","bu nima ekanini konditsioner yoqilgan studiyada turib tushuntirib berolmayman ochigʻi. Ha aytgancha, gapning xonasi kelganda aytib olay. 22-iyul kuni Navoiy viloyatining gʻarbiy choʻl hududi dunyoning eng issiq nuqtasiga aylandi.",buni men konditsioner yoqilgan studiyada turib tushuntirib bera olmayman ochiqi ha aytgancha gapning xonasi kelganda aytib olay yigirma ikkinchi iyul kuni navoiy viloyatining g'arbiy cho'l hududi dunyoning eng issiq nuqtasiga aylandi,bu nima ekanini konditsioner yoqilgan studiyada turib tushuntirib berolmayman ochig'i ha aytgancha gapning xonasi kelganda aytib olay yigirma ikkinchi iyul kuni navoiy viloyatining g'arbiy cho'l hududi dunyoning eng issiq nuqtasiga aylandi,0.1935,0.25,15.589375,"bu nima ekanini konditsioner yoqilgan studiyada turib tushuntirib bera olmayman ochigʻi. Ha aytgancha, gapning xonasi kelganda aytib olay. 22-iyul kuni Navoiy viloyatining gʻarbiy choʻl hududi dunyoning eng issiq nuqtasiga aylandi."
2234,00017667.wav,"uchun robotlarni yaratayapmiz. Sen yaratayapmiz. Ya'ni bu albatta Allohdan kelgan bir bu ham bir ilm bizga, bir yo'l ko'rsatadi va natijada biz shuni ixtiro qilamiz. Ish ham shu, uyalmaslik kerak, chunki","Shuning uchun robotlarni yaratyapmiz. Biz yaratyapmiz. Ya'ni bu, albatta, Ollohdan kelgan bir, bu ham bir ilm bizga. Bir yo'l ko'rsatadi. Va natijada bizlar shuni ixtiro qilamiz. Ish ham shu, uyalmaslik kerak. Chunki...",uchun robotlarni yaratayapmiz sen yaratayapmiz ya'ni bu albatta allohdan kelgan bir bu ham bir ilm bizga bir yo'l ko'rsatadi va natijada biz shuni ixtiro qilamiz ish ham shu uyalmaslik kerak chunki,shuning uchun robotlarni yaratyapmiz biz yaratyapmiz ya'ni bu albatta ollohdan kelgan bir bu ham bir ilm bizga bir yo'l ko'rsatadi va natijada bizlar shuni ixtiro qilamiz ish ham shu uyalmaslik kerak chunki,0.1935,0.2233,18.1066875,"uchun robotlarni yaratayapmiz. Biz yaratayapmiz. Ya'ni bu albatta Allohdan kelgan bir bu ham bir ilm bizga, bir yo'l ko'rsatadi va natijada biz shuni ixtiro qilamiz. Ish ham shu, uyalmaslik kerak, chunki"
66,00000375.wav,"bo'lish uchun treningni o'tish kerak. O'sha narsaga juda ham qiziqardim, harakat qilib, qani qanaqa bo'lar ekan, o'sha narsalarni o'rganishga harakat qilib, o'sha yordam bergan deb o'ylayman.","fasilitator bo'lish uchun treningdan o'tish kerak. O'sha narsalarga juda ham qiziqardim, harakat qilib, qani qanaqa bo'larkan, o'sha narsalarni o'rganishga harakat qilib, o'sha yordam bergan deb o'ylayman.",bo'lish uchun treningni o'tish kerak o'sha narsaga juda ham qiziqardim harakat qilib qani qanaqa bo'lar ekan o'sha narsalarni o'rganishga harakat qilib o'sha yordam bergan deb o'ylayman,fasilitator bo'lish uchun treningdan o'tish kerak o'sha narsalarga juda ham qiziqardim harakat qilib qani qanaqa bo'larkan o'sha narsalarni o'rganishga harakat qilib o'sha yordam bergan deb o'ylayman,0.1923,0.9479,13.232,"fasilitator bo'lish uchun treningdan o'tish kerak. O'sha narsalarga juda ham qiziqardim, harakat qilib, qani qanaqa bo'lar ekan, o'sha narsalarni o'rganishga harakat qilib, o'sha yordam bergan deb o'ylayman."
576,00004354.wav,123 600 000 so'm pul va 20 477 500 so'm pul Ibrohimov Izzat Ahmadjonovdan olingan.,bir yuz yigirma uch million olti yuz ming pul va sol pul va yigirma million toʻrt yuz yetmish yetti ming besh yuz soʻm pul. Ibragimov Izzat Ahmadjonovichdan olingan,bir yuz yigirma uch million olti yuz ming so'm pul va yigirma million to'rt yuz yetmish yetti ming besh yuz so'm pul ibrohimov izzat ahmadjonovdan olingan,bir yuz yigirma uch million olti yuz ming pul va sol pul va yigirma million to'rt yuz yetmish yetti ming besh yuz so'm pul ibragimov izzat ahmadjonovichdan olingan,0.1923,0.9464,14.576,bir yuz yigirma uch million olti yuz ming pul va so'm pul va yigirma million toʻrt yuz yetmish yetti ming besh yuz soʻm pul. Ibragimov Izzat Ahmadjonovichdan olingan
650,00004984.wav,"olganim uchun to'yingizdan qochib, 6 oy ichida mana bunaqa yomon grozali bo'ldi o'sha kuni siz ham eshitdingiz. Qochib ketib boshqa qilganim yo'q. Men Allohga tavakkal, to'g'risida.","olganim uchun. To yest men qochib, olti oy ichida mana bunaqa yomon ugrozalar bo'ldi o'sha kuni, siz ham eshitdingiz. Qochib ketib, boshqa qilganim yo'q. Allohga tavakkal. To'g'risida.",olganim uchun to'yingizdan qochib olti oy ichida mana bunaqa yomon grozali bo'ldi o'sha kuni siz ham eshitdingiz qochib ketib boshqa qilganim yo'q men allohga tavakkal to'g'risida,olganim uchun to yest men qochib olti oy ichida mana bunaqa yomon ugrozalar bo'ldi o'sha kuni siz ham eshitdingiz qochib ketib boshqa qilganim yo'q allohga tavakkal to'g'risida,0.1923,0.9352,14.064,"olganim uchun ya'ni men qochib, 6 oy ichida mana bunaqa yomon ugrozalar bo'ldi o'sha kuni siz ham eshitdingiz. Qochib ketib boshqa qilganim yo'q. Men Allohga tavakkal, to'g'risi-da."
1056,00008467.wav,"parlamentga hamda xalqimizga murojaatnomasida bevosita o'sha 2023-yilga ustuvor yo'nalishlardan biri sifatida ekologik masalalar bo'yicha masalalarga to'xtalib o'tdilar. Rahmat. Ibragimova Zuhra Axmedovna, marhamat.","parlamentga hamda xalqimizga murojaatnomasida bevosita ushbu 2023-yilgi ustuvor yo'nalishlardan biri sifatida ekologik masalalar bo'yicha ham masalalarga to'xtalib o'tdilar. Rahmat. Ibrohimova Zuhra Ahmedovna, marhamat.",parlamentga hamda xalqimizga murojaatnomasida bevosita o'sha ikki ming yigirma uchinchi yilga ustuvor yo'nalishlardan biri sifatida ekologik masalalar bo'yicha masalalarga to'xtalib o'tdilar rahmat ibragimova zuhra axmedovna marhamat,parlamentga hamda xalqimizga murojaatnomasida bevosita ushbu ikki ming yigirma uchinchi yilgi ustuvor yo'nalishlardan biri sifatida ekologik masalalar bo'yicha ham masalalarga to'xtalib o'tdilar rahmat ibrohimova zuhra ahmedovna marhamat,0.1923,0.8851,18.64,"parlamentga hamda xalqimizga murojaatnomasida bevosita ushbu 2023-yilgi ustuvor yo'nalishlardan biri sifatida ekologik masalalar bo'yicha ham masalalarga to'xtalib o'tdilar. Rahmat. Ibrohimova Zuhra Ahmedovna, marhamat."
1405,00011004.wav,"I think, shtobi kirib o'sha tam je med sestra stoyali zapisvali, cho ana etot rekomendovala. O'shani yozsin-u, i qilsin. I kirib qolgan kasallarni ham ko'rsin deb.","i ayting, shtobi kirib o'sha tam je medsyostr stoyali zapisyvali, cho ana etot rekomendovala. O'shani yozsinu i qilsin i kirib qolgan kasallarni ham ko'rsin deb",i think shtobi kirib o'sha tam je med sestra stoyali zapisvali cho ana etot rekomendovala o'shani yozsin-u i qilsin i kirib qolgan kasallarni ham ko'rsin deb,i ayting shtobi kirib o'sha tam je medsyostr stoyali zapisyvali cho ana etot rekomendovala o'shani yozsinu i qilsin i kirib qolgan kasallarni ham ko'rsin deb,0.1923,0.9618,15.472,"va ayting, shtobi kirib o'sha tam je medsyostr stoyali zapisyvali, cho ana etot rekomendovala. O'shani yozsin-u va qilsin va kirib qolgan kasallarni ham ko'rsin deb"
428,00003235.wav,"Endi men o'ylabmanki, smatryashiy degani bir qorovulmi, qanaqadir bir shunaqangi bir haligi bo'lsa kerak deb o'yladim. Keyin tushuntirishlari bo'yicha smatryashiy ekan.","Endi men oʻylabmanki, smatryashchiy degani bir qorovul, mana qanaqadir bir shunaqangi bir haligi boʻlsa kerak deb oʻyladim. Keyin tushuntirishlari boʻyicha smatrashi ekan.",endi men o'ylabmanki smatryashiy degani bir qorovulmi qanaqadir bir shunaqangi bir haligi bo'lsa kerak deb o'yladim keyin tushuntirishlari bo'yicha smatryashiy ekan,endi men o'ylabmanki smatryashchiy degani bir qorovul mana qanaqadir bir shunaqangi bir haligi bo'lsa kerak deb o'yladim keyin tushuntirishlari bo'yicha smatrashi ekan,0.1905,0.9728,10.8106875,"Endi men o'ylabmanki, smatryashiy degani bir qorovulmi, qanaqadir bir shunaqangi bir haligi bo'lsa kerak deb o'yladim. Keyin tushuntirishlari bo'yicha smatryashiy ekan."
757,00005812.wav,"generativ model yaratasiz, keyin diskriminativ model yaratasiz. Generativ yaratuvchi bo'ladigan bo'lsa, yaratgan narsalarini diskriminativ narsa diskriminate qilish, ya'ni ajrata olishlik qobiliyati.","generativ model yaratasiz, keyin diskriminativ modelni yaratasiz. generativ yaratuvchi bo'ladigan bo'lsa, yaratgan narsalarni diskriminativ narsa discriminate qilish, ya'ni ajrata olishlilik qobiliyati.",generativ model yaratasiz keyin diskriminativ model yaratasiz generativ yaratuvchi bo'ladigan bo'lsa yaratgan narsalarini diskriminativ narsa diskriminate qilish ya'ni ajrata olishlik qobiliyati,generativ model yaratasiz keyin diskriminativ modelni yaratasiz generativ yaratuvchi bo'ladigan bo'lsa yaratgan narsalarni diskriminativ narsa discriminate qilish ya'ni ajrata olishlilik qobiliyati,0.1905,0.9821,13.701375,"generativ model yaratasiz, keyin diskriminativ modelni yaratasiz. generativ yaratuvchi bo'ladigan bo'lsa, yaratgan narsalarini diskriminativ narsa discriminate qilish, ya'ni ajrata olishlilik qobiliyati."
836,00006643.wav,qilinadi. Ikkala yarim qo'lqop ustasi bilan ham muloqotda bo'lgan qalampir.uz sayti ushbu video orqali yuqoridagi savolga imkon qadar aniq javob beradi.,hal qilinadi. Ikkala charm qo'lqop ustasi bilan ham muloqotda bo'lgan Qalampir Uz sayti ushbu video orqali yuqoridagi savolga imkon qadar aniq javob beradi.,qilinadi ikkala yarim qo'lqop ustasi bilan ham muloqotda bo'lgan qalampiruz sayti ushbu video orqali yuqoridagi savolga imkon qadar aniq javob beradi,hal qilinadi ikkala charm qo'lqop ustasi bilan ham muloqotda bo'lgan qalampir uz sayti ushbu video orqali yuqoridagi savolga imkon qadar aniq javob beradi,0.1905,0.9703,12.8,qilinadi. Ikkala charm qo'lqop ustasi bilan ham muloqotda bo'lgan Qalampir Uz sayti ushbu video orqali yuqoridagi savolga imkon qadar aniq javob beradi.
920,00007436.wav,1 polivoy deydi ruslar aytganda yoki bo'lmasam Messini Messi qilgan bu jamoa yoki Ronaldoni Ronaldo qilgan bu jamoa ya'ni Ronaldoni deylik,"adin pole nivoin deydi ruslar aytganda, yoki bo'masam Messini Messi qilgan bu jamoa, yoki Ronaldoni Ronaldo qilgan bu jamoa. Ya'ni Ronaldoni deylik,",bir polivoy deydi ruslar aytganda yoki bo'lmasam messini messi qilgan bu jamoa yoki ronaldoni ronaldo qilgan bu jamoa ya'ni ronaldoni deylik,adin pole nivoin deydi ruslar aytganda yoki bo'masam messini messi qilgan bu jamoa yoki ronaldoni ronaldo qilgan bu jamoa ya'ni ronaldoni deylik,0.1905,0.9577,13.68,adin pole nivoin deydi ruslar aytganda yoki bo'lmasam Messini Messi qilgan bu jamoa yoki Ronaldoni Ronaldo qilgan bu jamoa ya'ni Ronaldoni deylik
2091,00016615.wav,"yashab kelayotgan Baxriddin siz mana O'zbekistonda bir jamoa oshpazlar, lekin ulardan tashqari boshqa idoralar ham ancha yordam etdi, o'shani ham bir sanab o'tadigan bo'lsak, u tarafdan kimni yordam etdi bizga? Ha, O'zbekiston tarafdan, O'zbekiston tarafdan deydigan bo'lsak","Londonda yashab kelayotgan. Bahriddin, siz mana Oʻzbekistondan bir jamoa oshpazlar. Lekin ulardan tashqari boshqa idoralar ham ancha yordam etadi. Oʻshalarni ham bir sanab oʻtadigan boʻlsak, u tarafdan kimlar yordam etadi bizga? Ha, Oʻzbekiston tarafdan. Oʻzbekiston tarafdan deydigan boʻlsak,",yashab kelayotgan baxriddin siz mana o'zbekistonda bir jamoa oshpazlar lekin ulardan tashqari boshqa idoralar ham ancha yordam etdi o'shani ham bir sanab o'tadigan bo'lsak u tarafdan kimni yordam etdi bizga ha o'zbekiston tarafdan o'zbekiston tarafdan deydigan bo'lsak,londonda yashab kelayotgan bahriddin siz mana o'zbekistondan bir jamoa oshpazlar lekin ulardan tashqari boshqa idoralar ham ancha yordam etadi o'shalarni ham bir sanab o'tadigan bo'lsak u tarafdan kimlar yordam etadi bizga ha o'zbekiston tarafdan o'zbekiston tarafdan deydigan bo'lsak,0.1892,0.7174,15.301375,"Londonda yashab kelayotgan. Bahriddin, siz mana Oʻzbekistondan bir jamoa oshpazlar. Lekin ulardan tashqari boshqa idoralar ham ancha yordami tegdi. Oʻshalarni ham bir sanab oʻtadigan boʻlsak, bu tarafdan kimlarni yordami tegdi bizga? Ha, Oʻzbekiston tarafdan. Oʻzbekiston tarafdan deydigan boʻlsak,"
65,00000374.wav,"sal ichkaridagi kuxnyani tushungandan keyin texnikskiy kuchliroqman ularga nisbatan, lekin ular o'zini shunaqangi prezentatsiya qilib beryapti.","sal ichkaridagi kuxnyani tushungandan keyin, men texnicheskiy kuchliroqman ularga nisbatan. Lekin ular ular o'zini shunaqangi prezentatsiya qilib beryapti.",sal ichkaridagi kuxnyani tushungandan keyin texnikskiy kuchliroqman ularga nisbatan lekin ular o'zini shunaqangi prezentatsiya qilib beryapti,sal ichkaridagi kuxnyani tushungandan keyin men texnicheskiy kuchliroqman ularga nisbatan lekin ular ular o'zini shunaqangi prezentatsiya qilib beryapti,0.1875,0.9556,10.61,"sal ichkaridagi kuxnyani tushungandan keyin, men texnicheskiy kuchliroqman ularga nisbatan. Lekin ular o'zini shunaqangi prezentatsiya qilib beryapti."
947,00007651.wav,"To'g'ri bu kratka so'rovchini deb balkim juda zo'r effekt bermas, qanaqa bo'ladi? Ilm farqi yo'q, bolalarimiz bog'chasi ham ilm, maktabi ham ilm, universitetlarimiz ham ilm, tadbirkorlarimiz ham ilm, bu juda katta o'tkanda.","To'g'ri, bu kratkasrochniyda, balkim ja zo'r effekt bermas. Qanaqa bo'ladi? Ilm farqi yo'q, u bolalarimiz bog'chasi ham ilm, maktabi ham ilm, universitetlarimiz ham ilm, tadbirkorlarimiz ham ilm. Bu juda katta okenda.",to'g'ri bu kratka so'rovchini deb balkim juda zo'r effekt bermas qanaqa bo'ladi ilm farqi yo'q bolalarimiz bog'chasi ham ilm maktabi ham ilm universitetlarimiz ham ilm tadbirkorlarimiz ham ilm bu juda katta o'tkanda,to'g'ri bu kratkasrochniyda balkim ja zo'r effekt bermas qanaqa bo'ladi ilm farqi yo'q u bolalarimiz bog'chasi ham ilm maktabi ham ilm universitetlarimiz ham ilm tadbirkorlarimiz ham ilm bu juda katta okenda,0.1875,0.91,15.6,"To'g'ri, bu kratkasrochniyda, balkim ja zo'r effekt bermas. Qanaqa bo'ladi? Ilm farqi yo'q, u bolalarimiz bog'chasi ham ilm, maktabi ham ilm, universitetlarimiz ham ilm, tadbirkorlarimiz ham ilm. Bu juda katta okeanda."
1016,00008158.wav,Siz nima qilyapsiz hozir? Unaqa narsadan xabarim yo'q edi lekin. Yo'q yo'q unaqa narsalarni bilmayman. Yo'q. Yo'q men u ishni qilmayman. Ha bu chaqimchilikmi sizniki? Ha bu yomon bo'ladi bu. Xabarim bor.,"Istemol qilyapti hozir. Unaqa xabarim yo'q edi lekin. Yo'q, yo'q, unaqa narsalarni bilmayman. Yo'q. Yo'q, men u ishni qilmayman. A bu chaqimchilikmi sizningcha? Ha, bu yomon bo'ladi bu. Xabarim bor.",siz nima qilyapsiz hozir unaqa narsadan xabarim yo'q edi lekin yo'q yo'q unaqa narsalarni bilmayman yo'q yo'q men u ishni qilmayman ha bu chaqimchilikmi sizniki ha bu yomon bo'ladi bu xabarim bor,istemol qilyapti hozir unaqa xabarim yo'q edi lekin yo'q yo'q unaqa narsalarni bilmayman yo'q yo'q men u ishni qilmayman a bu chaqimchilikmi sizningcha ha bu yomon bo'ladi bu xabarim bor,0.1875,0.9186,16.325375,"Iste'mol qilyapti hozir. Unaqadan xabarim yo'q edi lekin. Yo'q yo'q unaqa narsalarni bilmayman. Yo'q. Yo'q men u ishni qilmayman. Ha bu chaqimchilikmi sizningcha? Ha bu yomon bo'ladi bu. Xabarim bor."
1509,00011738.wav,"haqida jurnalist, blogger va faollar nima derkin? Понятия не имею. Nega? Chunki ishlamaydigan tuzilmalarga vaqtimni sarflamayman.","haqida, jurnalist, blogger va faollar nima derkin? Ponyatiya ne imeyu. Nega? Chunki ishlamaydigan tuzilmalarga vaqtimni sarflamayman.",haqida jurnalist blogger va faollar nima derkin понятия не имею nega chunki ishlamaydigan tuzilmalarga vaqtimni sarflamayman,haqida jurnalist blogger va faollar nima derkin ponyatiya ne imeyu nega chunki ishlamaydigan tuzilmalarga vaqtimni sarflamayman,0.1875,0.8845,11.0,"haqida jurnalist, bloger va faollar nima der ekan? Ponyatiya ne imeyu. Nega? Chunki ishlamaydigan tuzilmalarga vaqtimni sarflamayman."
1904,00015200.wav,"Bir odamni ko'mak bo'lib, yelkadosh bo'lib, u odamni g'ildiragi aylanib, uch yildan keyin davlatimga kerak emas. U aylanib, o'zini topadi u. Hozir aylanilgan, aylanma mablag'i yo'q uning. Oborotni pulga puli yo'q uning.","bir odamni koʻmak boʻlib, yelkadosh boʻlib, u odamni gʻildiragi aylanib, uch yildan keyin davlatimga kerak emas. U aylanchoq, oʻzini topadi u. Hozir aynalgan aynalma mablagʻi yoʻq uni. Oborotniy pulga puli yoʻq uni.",bir odamni ko'mak bo'lib yelkadosh bo'lib u odamni g'ildiragi aylanib uch yildan keyin davlatimga kerak emas u aylanib o'zini topadi u hozir aylanilgan aylanma mablag'i yo'q uning oborotni pulga puli yo'q uning,bir odamni ko'mak bo'lib yelkadosh bo'lib u odamni g'ildiragi aylanib uch yildan keyin davlatimga kerak emas u aylanchoq o'zini topadi u hozir aynalgan aynalma mablag'i yo'q uni oborotniy pulga puli yo'q uni,0.1875,0.9113,16.2186875,"Bir odamni ko'mak bo'lib, yelkadosh bo'lib, u odamni g'ildiragi aylanib, uch yildan keyin davlat unga kerak emas. U aylansa, o'zini topadi u. Hozir aylangan, aylanma mablag'i yo'q uning. Oborotniy pulga puli yo'q uni."
2426,00019079.wav,"Tushuntira oldimmi senga? Tushunarli rahbar. Buni olib qarasangiz, men uni katta narsani sotyapman, uni kichkina narsa olyapman. O'ylashi mumkin odamlar, nimaga bu katta narsani sotyapti-da, kichkina narsa sotyapti. U ham qiziq narsa.","Tushuntira oldimmi? Tushunarli. Bundoq olib qarasangiz, men uni katta narsani sotyapman, uning kichkina narsasini olyapman. O'ylashi mumkin odamlar, nimaga bu katta narsani sotyapti-yu, kichkina narsa sotyapti? U ham qiziq narsa.",tushuntira oldimmi senga tushunarli rahbar buni olib qarasangiz men uni katta narsani sotyapman uni kichkina narsa olyapman o'ylashi mumkin odamlar nimaga bu katta narsani sotyapti-da kichkina narsa sotyapti u ham qiziq narsa,tushuntira oldimmi tushunarli bundoq olib qarasangiz men uni katta narsani sotyapman uning kichkina narsasini olyapman o'ylashi mumkin odamlar nimaga bu katta narsani sotyapti-yu kichkina narsa sotyapti u ham qiziq narsa,0.1875,0.1124,13.584,"Tushuntira oldimmi singlim? Tushunarli rahmat. Bundoq olib qarasangiz, men uni katta narsani sotyapman, uni kichkina narsa olyapman. O'ylashi mumkin odamlar, nimaga bu katta narsani sotyapti-da, kichkina narsa sotib olyapti. U ham qiziq narsa."
2582,00020252.wav,"eng ko'p so'rashgan odam bu Sanjar aka bo'ldi. Sanjar aka, da. Sanjar aka, Mavlanov-Mavlanov kompaniyasini asoschisi.","eng ko'p so'rashgan odam bu Sanjar aka bo'ldi. Sanjar aka. Sanjar aka Mavlanov, Manav kompaniyasini asoschisi.",eng ko'p so'rashgan odam bu sanjar aka bo'ldi sanjar aka da sanjar aka mavlanov-mavlanov kompaniyasini asoschisi,eng ko'p so'rashgan odam bu sanjar aka bo'ldi sanjar aka sanjar aka mavlanov manav kompaniyasini asoschisi,0.1875,0.9541,9.637375,"eng ko'p so'rashgan odam bu Sanjar aka bo'ldi. Sanjar aka, ha. Sanjar aka, Mavlanov Manef kompaniyasini asoschisi."
1956,00015540.wav,"unaqa bir tushuncha bor iqtisodiy nazariyada, ekonomik agent deydi, iqtisodiy agent. Ya'ni iqtisodiy agent desa, biznikilar srazu boshqa narsani tushunadi. Ekonomik agent deganda bu narsa boshqa narsa tushuniladida. Bu birlik deylik, u shaxs bo'lishi mumkin, shaxs deylik, yo yuridik shaxs yoki jismoniy shaxs.","bunaqa bir tushuncha bor, iqtisodiy nazariyada, economic agent deydi, a? Iqtisodiy agent. Agent. Ya'ni iqtisodiy agent desa biznikilar srazu boshqani tushunadi. Economic agent deganda bu narsa boshqa narsa tushuniladi-da. Bu birlik deylik, u shaxs bo'lishi mumkin, shaxs deylik, yo yuridik shaxs yoki jismoniy shaxs.",unaqa bir tushuncha bor iqtisodiy nazariyada ekonomik agent deydi iqtisodiy agent ya'ni iqtisodiy agent desa biznikilar srazu boshqa narsani tushunadi ekonomik agent deganda bu narsa boshqa narsa tushuniladida bu birlik deylik u shaxs bo'lishi mumkin shaxs deylik yo yuridik shaxs yoki jismoniy shaxs,bunaqa bir tushuncha bor iqtisodiy nazariyada economic agent deydi a iqtisodiy agent agent ya'ni iqtisodiy agent desa biznikilar srazu boshqani tushunadi economic agent deganda bu narsa boshqa narsa tushuniladi-da bu birlik deylik u shaxs bo'lishi mumkin shaxs deylik yo yuridik shaxs yoki jismoniy shaxs,0.186,0.649,19.2906875,"bunaqa bir tushuncha bor, iqtisodiy nazariyada, ekonimik agent deydi. Iqtisodiy agent. Agent. Ya'ni iqtisodiy agent desa biznikilar srazu boshqani tushunadi. Ekonimik agent deganda bu narsa boshqa narsa tushuniladi-da. Bu birlik deylik, u shaxs bo'lishi mumkin, shaxs deylik, yo yuridik shaxs yoki jismoniy shaxs."
