id,path,text_spt,text_original,ref_normalized,hyp_normalized,wer,sequence_similarity,duration,sentence_checked
2526,00019931.wav,"Har bir narsa bizni ko'zimizga oddiy ko'ringan narsani ham o'zini qanaqadir life cycle bor. Nimadir tizimni bitta kichkina bo'lagida. Ya'ni hasharotlargacha, dunyodagi juda kichkina narsalargacha o'zini funksiyasi bor ekan. Inson boya funksiyasi, missiyasi bo'lmasligi bu umuman mantiqqa to'g'ri kelmaydi-da.","har bir narsa bizni ko'zimizga oddiy ko'ringan narsani ham o'zini qanaqa bir life cycle bor. Nimadir tizimni bitta kichkina bo'lagi-da. Ya'ni hashorotlargacha, dunyodagi juda kichkina narsalargacha o'zini funksiyasi bor ekan. Inson boyagi funksiyasi, missiyasi bo'lmasligi bu umuman mantiqqa to'g'ri kelmaydi-da.",har bir narsa bizni ko'zimizga oddiy ko'ringan narsani ham o'zini qanaqadir life cycle bor nimadir tizimni bitta kichkina bo'lagida ya'ni hasharotlargacha dunyodagi juda kichkina narsalargacha o'zini funksiyasi bor ekan inson boya funksiyasi missiyasi bo'lmasligi bu umuman mantiqqa to'g'ri kelmaydi-da,har bir narsa bizni ko'zimizga oddiy ko'ringan narsani ham o'zini qanaqa bir life cycle bor nimadir tizimni bitta kichkina bo'lagi-da ya'ni hashorotlargacha dunyodagi juda kichkina narsalargacha o'zini funksiyasi bor ekan inson boyagi funksiyasi missiyasi bo'lmasligi bu umuman mantiqqa to'g'ri kelmaydi-da,0.1282,0.9441,19.248,"Har bir narsa bizni ko'zimizga oddiy ko'ringan narsani ham o'zini qanaqadir life cycle bor. Nimadir tizimni bitta kichkina bo'lagi-da. Ya'ni hasharotlargacha, dunyodagi juda kichkina narsalargacha o'zini funksiyasi bor ekan. Inson boyagi funksiyasi, missiyasi bo'lmasligi bu umuman mantiqqa to'g'ri kelmaydi-da."
1793,00014325.wav,"garchilik bo'ladigan kunlar soni 9-13 kungacha ko'payadi. Shunday qilib, qishki kiyimlarni javonga joylab, yozgilarni olish vaqti keldi. Menimcha, aprel oyida bizga soybonlar ham kerak bo'lmaydi.","yogʻingarchilik boʻladigan kunlar soni toʻqqiz, 13 kungacha koʻpayadi. Shunday qilib, qishki kiyimlarni jovonga joylab, yozgilarni olish vaqti keldi. Menimcha aprel oyida bizga soyabonlar ham kerak boʻlmaydi.",garchilik bo'ladigan kunlar soni to'qqiz-o'n uch kungacha ko'payadi shunday qilib qishki kiyimlarni javonga joylab yozgilarni olish vaqti keldi menimcha aprel oyida bizga soybonlar ham kerak bo'lmaydi,yog'ingarchilik bo'ladigan kunlar soni to'qqiz o'n uch kungacha ko'payadi shunday qilib qishki kiyimlarni jovonga joylab yozgilarni olish vaqti keldi menimcha aprel oyida bizga soyabonlar ham kerak bo'lmaydi,0.1923,0.8452,13.232,"yogʻingarchilik boʻladigan kunlar soni 9-13 kungacha koʻpayadi. Shunday qilib, qishki kiyimlarni javonga joylab, yozgilarini olish vaqti keldi. Menimcha aprel oyida bizga soyabonlar ham kerak boʻlmaydi."
2038,00016295.wav,Men hali bularga yana qo'shimcha ravishda yana bitta band bor. Importni rasmiylashtirishda qo'shilgan qiymat solig'ini to'lashda ham yengilliklar yana ham kuchaytirilyapti bularga.,"Men hali bularga yana qo'shimcha ravishda yana bitta band bor. Importni rasmiylashtirilishda, qo'shilgan qiymat solig'ini to'lashda ham yengilliklar yana ham kuchaytirilyapti bularga.",men hali bularga yana qo'shimcha ravishda yana bitta band bor importni rasmiylashtirishda qo'shilgan qiymat solig'ini to'lashda ham yengilliklar yana ham kuchaytirilyapti bularga,men hali bularga yana qo'shimcha ravishda yana bitta band bor importni rasmiylashtirilishda qo'shilgan qiymat solig'ini to'lashda ham yengilliklar yana ham kuchaytirilyapti bularga,0.0455,0.9944,12.965375,"Men hali bularga yana qo'shimcha ravishda yana bitta band bor. Importni rasmiylashtirilishda, qo'shilgan qiymat solig'ini to'lashda ham yengilliklar yana ham kuchaytirilyapti bularga."
1848,00014797.wav,"yengil, shularga ham alohida to'xtalib, alohida ular bilan ham umumiy til topish","baʼzida yengil, ularga ham alohida toʻxtalib, alohida ular bilan ham umumiy til topish",yengil shularga ham alohida to'xtalib alohida ular bilan ham umumiy til topish,ba'zida yengil ularga ham alohida to'xtalib alohida ular bilan ham umumiy til topish,0.1667,0.9383,10.309375,"baʼzida yengil, shularga ham alohida toʻxtalib, alohida ular bilan ham umumiy til topish"
2282,00018000.wav,"U yerda o'sha polniy, masalan, payment processing qanday ishlaydi, onlayn to'lovlar qanday ishlaydi, ular qanaqa qilib","U yerda o'sha polniy, masalan, payment processing qanday ishlaydi? Mhm. onlayn to'lovlar qanday ishlaydi? Mhm. Ular qanaqa qilib",u yerda o'sha polniy masalan payment processing qanday ishlaydi onlayn to'lovlar qanday ishlaydi ular qanaqa qilib,u yerda o'sha polniy masalan payment processing qanday ishlaydi mhm onlayn to'lovlar qanday ishlaydi mhm ular qanaqa qilib,0.125,0.9661,14.384,"U yerda o'sha polniy, masalan, payment processing qanday ishlaydi, onlayn to'lovlar qanday ishlaydi, ular qanaqa qilib"
1108,00008837.wav,"Hamma ko'rilgan choralar, imkoniyatlar yaratish natijasida mamlakatimiz mana shu tarixida, saylov tarixida birinchi marta 212 000 dan ortiq saylovchilarimiz ishtirok etdi xalqaro, xorijiy davlatlarda ovoz berishda.","hamma koʻrilgan choralar, imkoniyatlar yaratish natijasida mamlakatimiz mana shu tarixida, saylov tarixida birinchi marta 212 mingdan ortiq saylovchilarimiz ishtirok etdi, xalqaro, xorijiy davlatlarda ovoz berishda.",hamma ko'rilgan choralar imkoniyatlar yaratish natijasida mamlakatimiz mana shu tarixida saylov tarixida birinchi marta ikki yuz o'n ikki ming dan ortiq saylovchilarimiz ishtirok etdi xalqaro xorijiy davlatlarda ovoz berishda,hamma ko'rilgan choralar imkoniyatlar yaratish natijasida mamlakatimiz mana shu tarixida saylov tarixida birinchi marta ikki yuz o'n ikki mingdan ortiq saylovchilarimiz ishtirok etdi xalqaro xorijiy davlatlarda ovoz berishda,0.069,0.9978,14.2026875,"hamma koʻrilgan choralar, imkoniyatlar yaratish natijasida mamlakatimiz mana shu tarixida, saylov tarixida birinchi marta 212 mingdan ortiq saylovchilarimiz ishtirok etdi, xalqaro, xorijiy davlatlarda ovoz berishda."
654,00005022.wav,"Assalomu alaykum, mamlakatimizda 10-iyun sanasida yuz bergan muhim voqea-hodisalar tafsiloti bilan tanishtiramiz.",Assalomu alaykum. Mamlakatimizda 10-iyun sanasida yuz bergan muhim voqea hodisalar tafsiloti bilan tanishtiramiz.,assalomu alaykum mamlakatimizda o'ninchi iyun sanasida yuz bergan muhim voqea-hodisalar tafsiloti bilan tanishtiramiz,assalomu alaykum mamlakatimizda o'ninchi iyun sanasida yuz bergan muhim voqea hodisalar tafsiloti bilan tanishtiramiz,0.1538,0.9915,8.072,"Assalomu alaykum, mamlakatimizda 10-iyun sanasida yuz bergan muhim voqea-hodisalar tafsiloti bilan tanishtiramiz."
2391,00018816.wav,"Misol, oila davrasini oldida biz ko'ra olmaymiz-da, har xil vaziyatlar bo'ladi, yoki chiqib ketishimiz kerak, yo boshqa narsa ko'rishimiz kerak. Oila davrasida uje ko'rmayman men. Ota-ona bilan to'g'risi ko'radigan seriallar yo'q.",misol oila davrasini oldi biz koʻra olmaymiz-da. har xil vaziyatlar boʻladi yoki chiqib ketishimiz kerak yo boshqa narsa koʻrishimiz kerak. Oila davrasida uje koʻrmayman men. Ota-ona bilan toʻgʻrisi koʻradigan seriallar yoʻq.,misol oila davrasini oldida biz ko'ra olmaymiz-da har xil vaziyatlar bo'ladi yoki chiqib ketishimiz kerak yo boshqa narsa ko'rishimiz kerak oila davrasida uje ko'rmayman men ota-ona bilan to'g'risi ko'radigan seriallar yo'q,misol oila davrasini oldi biz ko'ra olmaymiz-da har xil vaziyatlar bo'ladi yoki chiqib ketishimiz kerak yo boshqa narsa ko'rishimiz kerak oila davrasida uje ko'rmayman men ota-ona bilan to'g'risi ko'radigan seriallar yo'q,0.0323,0.9955,16.06,"Misol, oila davrasini oldida biz ko'ra olmaymiz-da, har xil vaziyatlar bo'ladi, yoki chiqib ketishimiz kerak, yo boshqa narsa ko'rishimiz kerak. Oila davrasida uje ko'rmayman men. Ota-ona bilan to'g'risi ko'radigan seriallar yo'q."
1523,00011818.wav,"Turli davlatlarda 50 kundan 365 kungacha cheklovlar o'rnatilgan. Bularni endi bu tirbandlik emas, shovqinga qarshi kurash bo'lsa kerak.","langan. Turli davlatlarda 50 kundan 365 kungacha cheklovlar oʻrnatilgan. Bularda endi bu tirbandlik emas, shovqinga qarshi kurash boʻlsa kerak.",turli davlatlarda ellik kundan uch yuz oltmish besh kungacha cheklovlar o'rnatilgan bularni endi bu tirbandlik emas shovqinga qarshi kurash bo'lsa kerak,langan turli davlatlarda ellik kundan uch yuz oltmish besh kungacha cheklovlar o'rnatilgan bularda endi bu tirbandlik emas shovqinga qarshi kurash bo'lsa kerak,0.0952,0.9646,11.504,"Turli davlatlarda 50 kundan 365 kungacha cheklovlar o'rnatilgan. Bularda endi bu tirbandlik emas, shovqinga qarshi kurash bo'lsa kerak."
2119,00016809.wav,Bolaligingizdagi nima omillar sabab bo'lgan degan savol bersam. Bitta saqizni research qilayotganimizda qiziq voqea aytib bergan ekansiz o'zingiz. Bolaligingizdan tadbirkorlik anaqasi bo'lgan sizda. O'sha gangadagi o'chiritlarni masalan pulga berishingiz.,"bolaligingizdagi nima omillar sabab bo'lgan degan savol bersam. Bitta saqizli research qilayotganimizda qiziq voqea aytib bergan ekansiz o'zingiz. Bolaligingizdan tadbirkorlik anaqasi bo'lgansizda. O'sha Gangadagi o'chiritlarni masalan pulga berishingiz,",bolaligingizdagi nima omillar sabab bo'lgan degan savol bersam bitta saqizni research qilayotganimizda qiziq voqea aytib bergan ekansiz o'zingiz bolaligingizdan tadbirkorlik anaqasi bo'lgan sizda o'sha gangadagi o'chiritlarni masalan pulga berishingiz,bolaligingizdagi nima omillar sabab bo'lgan degan savol bersam bitta saqizli research qilayotganimizda qiziq voqea aytib bergan ekansiz o'zingiz bolaligingizdan tadbirkorlik anaqasi bo'lgansizda o'sha gangadagi o'chiritlarni masalan pulga berishingiz,0.1034,0.994,18.416,Bolaligingizdagi nima omillar sabab bo'lgan degan savol bersam. Bitta siz haqingizda research qilayotganimizda qiziq voqea aytib bergan ekansiz o'zingiz. Bolaligingizdan tadbirkorlik anaqasi bo'lgan sizda. O'sha gangadagi o'chiritlarni masalan pulga berishingiz.
1938,00015394.wav,O'zbekiston umuman meni nazarimda karantin nimasi joriy qilish uchun juda yaxshi qanaqa tashkiliy nuqtai nazardan tashkilotchi nuqtai nazardan yaxshi ish tutdi.,"Oʻzbekiston, umuman, mani nazarimda karantin nimmasini joriy qilish uchun juda yaxshi, qanaqa tashkiliy nuqtai nazardan, tashkilotchi nuqtai nazardan yaxshi ish tutdi.",o'zbekiston umuman meni nazarimda karantin nimasi joriy qilish uchun juda yaxshi qanaqa tashkiliy nuqtai nazardan tashkilotchi nuqtai nazardan yaxshi ish tutdi,o'zbekiston umuman mani nazarimda karantin nimmasini joriy qilish uchun juda yaxshi qanaqa tashkiliy nuqtai nazardan tashkilotchi nuqtai nazardan yaxshi ish tutdi,0.0952,0.9844,10.501375,O'zbekiston umuman meni nazarimda karantin nimasi joriy qilish uchun juda yaxshi qanaqa tashkiliy nuqtai nazardan tashkilotchi nuqtai nazardan yaxshi ish tutdi.
1142,00009112.wav,"ya'ni qanchalik natija beryapti, bunga sarflanayotgan xarajatlarni oqlayaptimi, yoki shu targ'ibot olib borilgan hududlarda boshqa hududlarga nisbatan ya'ni fojialar, favqulodda vaziyatlar kamayaptimi? Keyingisi mana asosan kelib chiqayotgan yong'inlar yoki isitish","mi ya'ni qanchalik natija beryapti? Bunga sarflanayotgan xarajatlarni oqlayaptimi? A yoki shu targ'ibot olib borilgan hududlarda boshqa hududlarga nisbatan, ya'ni fojialar, favqulodda vaziyatlar kam kamayaptimi? Keyingisi mana asosan kelib chiqayotgan yong'inlar yoki isitish",ya'ni qanchalik natija beryapti bunga sarflanayotgan xarajatlarni oqlayaptimi yoki shu targ'ibot olib borilgan hududlarda boshqa hududlarga nisbatan ya'ni fojialar favqulodda vaziyatlar kamayaptimi keyingisi mana asosan kelib chiqayotgan yong'inlar yoki isitish,mi ya'ni qanchalik natija beryapti bunga sarflanayotgan xarajatlarni oqlayaptimi a yoki shu targ'ibot olib borilgan hududlarda boshqa hududlarga nisbatan ya'ni fojialar favqulodda vaziyatlar kam kamayaptimi keyingisi mana asosan kelib chiqayotgan yong'inlar yoki isitish,0.1,0.9831,19.8026875,"muhimi ya'ni qanchalik natija beryapti, bunga sarflanayotgan xarajatlarni oqlayaptimi, yoki shu targ'ibot olib borilgan hududlarda boshqa hududlarga nisbatan ya'ni fojialar, favqulodda vaziyatlar kamayaptimi? Keyingisi mana asosan kelib chiqayotgan yong'inlar yoki isitish"
1329,00010366.wav,"jinoiy harakatlar sodir etilgan jinoyatga daxli bo'lmaganligi sababli, O'zbekiston Respublikasi Jinoyat protsessual kodeksi 83-moddasi uchinchi bandiga asosan aybsiz deb topilib reabilitatsiya etilsin hamda jinoyat ishi shu qismi tugatilsin.","tilgan jinoyatga daxli boʻlmaganligi sababli Oʻzbekiston Respublikasi Jinoyat protsessual kodeksining 83-moddasi uchinchi bandiga asosan aybsiz deb topilib, reabilitatsiya etilsin hamda jinoyat ishining shu qismi tugatilsin.",jinoiy harakatlar sodir etilgan jinoyatga daxli bo'lmaganligi sababli o'zbekiston respublikasi jinoyat protsessual kodeksi sakson uchinchi moddasi uchinchi bandiga asosan aybsiz deb topilib reabilitatsiya etilsin hamda jinoyat ishi shu qismi tugatilsin,tilgan jinoyatga daxli bo'lmaganligi sababli o'zbekiston respublikasi jinoyat protsessual kodeksining sakson uchinchi moddasi uchinchi bandiga asosan aybsiz deb topilib reabilitatsiya etilsin hamda jinoyat ishining shu qismi tugatilsin,0.2,0.9322,13.637375,"jinoiy harakatlar sodir etilgan jinoyatga daxli bo'lmaganligi sababli, O'zbekiston Respublikasi Jinoyat protsessual kodeksi 83-moddasi uchinchi bandiga asosan aybsiz deb topilib reabilitatsiya etilsin hamda jinoyat ishi shu qismi tugatilsin."
1332,00010390.wav,qancha vaqtda endi sizlar ham bilmaysizlar ijro Yo'q endi uni ijro qiladi bizlar hozir sizga sudni protsedurasini ya'ni shikoyat keltirilmasa bizlar 20 kunni ichida ijroga qaratamiz. Yana kimda nima savol bor?,"qancha vaqt... endi sizlar... bilmaysizlar ijro... Yoʻq, endi uni ijro qiladi. Bizlar hozir sizga sudni protsedurasini, yaʼni shikoyatlar keltirilmasa, bizlar 20 kunni ichida ijroga qaratamiz. Yana kimda nima savol bor?",qancha vaqtda endi sizlar ham bilmaysizlar ijro yo'q endi uni ijro qiladi bizlar hozir sizga sudni protsedurasini ya'ni shikoyat keltirilmasa bizlar yigirma kunni ichida ijroga qaratamiz yana kimda nima savol bor,qancha vaqt endi sizlar bilmaysizlar ijro yo'q endi uni ijro qiladi bizlar hozir sizga sudni protsedurasini ya'ni shikoyatlar keltirilmasa bizlar yigirma kunni ichida ijroga qaratamiz yana kimda nima savol bor,0.0968,0.9216,16.165375,"qancha vaqtda endi sizlar ham bilmaysizlar ijro Yo'q endi uni ijro qiladi bizlar hozir sizga sudni protsedurasini ya'ni shikoyat keltirilmasa bizlar 20 kunni ichida ijroga qaratamiz. Yana kimda nima savol bor?"
247,00001751.wav,borib o'zining qaysidir zarur muammosini hal qilishni so'rayotganda hokimiyat vakillari ularga mazkur muammoni hal qilish uchun tashabbusli budjetda ishtirok etishini so'raydi.,"iga borib, o'zining qaysidir zarur muammosini hal qilishini so'rayotganda, hokimiyat vakillari ularga mazkur muammoni hal qilish uchun tashabbusli budjetda ishtirok etishini so'raydi.",borib o'zining qaysidir zarur muammosini hal qilishni so'rayotganda hokimiyat vakillari ularga mazkur muammoni hal qilish uchun tashabbusli budjetda ishtirok etishini so'raydi,iga borib o'zining qaysidir zarur muammosini hal qilishini so'rayotganda hokimiyat vakillari ularga mazkur muammoni hal qilish uchun tashabbusli budjetda ishtirok etishini so'raydi,0.0952,0.9859,12.496,borib o'zining qaysidir zarur muammosini hal qilishini so'rayotganda hokimiyat vakillari ularga mazkur muammoni hal qilish uchun tashabbusli budjetda ishtirok etishini so'raydi.
90,00000515.wav,Qizil boylikda baholangan respublika darajasidagi idoralardan eng past ko'rsatkich,qizil toifada baholangan respublika darajasidagi idoralardan eng past koʻrsatkich,qizil boylikda baholangan respublika darajasidagi idoralardan eng past ko'rsatkich,qizil toifada baholangan respublika darajasidagi idoralardan eng past ko'rsatkich,0.1111,0.9571,7.365375,qizil toifada baholangan respublika darajasidagi idoralardan eng past koʻrsatkich
1684,00013089.wav,"ob-havo bo'lishi ham mumkin degan. O'shalar bo'yicha qisqacha ma'lumot berib yuborsangiz. Haqiqatdan hozir biz issiq havo oqimlari, ya'ni o'sha o'tgan dasturda aytib o'tganimizdek 17-18 mart kunlari respublika hududlariga g'arbdan issiq havo oqimlari kirib kelishini","ob-havo boʻlishi ham mumkin degan. Oʻshalar boʻyicha qisqacha maʼlumot berib yuborsangiz. Haqiqatdan hozir biz issiq havo oqimlari, yaʼni oʻsha oʻtgan dasturda aytib oʻtganimizdek, 17, 18-mart kunlari respublika hududlariga gʻarbdan issiq havo oqimlari kirib kelishini",ob-havo bo'lishi ham mumkin degan o'shalar bo'yicha qisqacha ma'lumot berib yuborsangiz haqiqatdan hozir biz issiq havo oqimlari ya'ni o'sha o'tgan dasturda aytib o'tganimizdek o'n yetti o'n sakkiz mart kunlari respublika hududlariga g'arbdan issiq havo oqimlari kirib kelishini,ob-havo bo'lishi ham mumkin degan o'shalar bo'yicha qisqacha ma'lumot berib yuborsangiz haqiqatdan hozir biz issiq havo oqimlari ya'ni o'sha o'tgan dasturda aytib o'tganimizdek o'n yetti o'n sakkizinchi mart kunlari respublika hududlariga g'arbdan issiq havo oqimlari kirib kelishini,0.027,0.9911,15.813375,"ob-havo bo'lishi ham mumkin degan. O'shalar bo'yicha qisqacha ma'lumot berib yuborsangiz. Haqiqatdan hozir biz issiq havo oqimlari, ya'ni o'sha o'tgan dasturda aytib o'tganimizdek 17-18-mart kunlari respublika hududlariga g'arbdan issiq havo oqimlari kirib kelishini"
214,00001516.wav,"Masalan, mana uzumni aytadigan bo'lsam, mana hammaniki ham shunaqa, mana liftlarimiz zavodimiz o'zi ham 5 yil, 10 yil liftni o'ziga kafolat beryapti.","Masalan, mana o'zimni aytadigan bo'lsam, mana hammaniki ham shunaqa, mana liftlarimiz zavodimiz o'zi ham besh yil, 10 yil liftni o'ziga kafolat berilyapti.",masalan mana uzumni aytadigan bo'lsam mana hammaniki ham shunaqa mana liftlarimiz zavodimiz o'zi ham besh yil o'n yil liftni o'ziga kafolat beryapti,masalan mana o'zimni aytadigan bo'lsam mana hammaniki ham shunaqa mana liftlarimiz zavodimiz o'zi ham besh yil o'n yil liftni o'ziga kafolat berilyapti,0.0909,0.9766,9.968,"Masalan, mana o'zimni aytadigan bo'lsam, mana hammaniki ham shunaqa, mana liftlarimiz zavodimiz o'zi ham besh yil, 10 yil liftni o'ziga kafolat berilyapti."
1903,00015196.wav,"100 milliongacha qancha pul hisoblashsa, kichkinagina odamga 200 000 dollar kerak, bitta Xitoydan uskuna olib kelib, 20 ta odamni ishlatish. Bitta odamga 100 000 dollar kerak, bitta odamga 500 000 dollar kerak, birovga va hokazo. Lekin biz aytamiz","100 milliongacha, qancha bular hisoblasa. Kichkinagina odamga 200 ming dollar kerak, bitta Xitoydan uskuna olib kelib, 20 ta odamni ishlatish. Bitta odamga 100 ming dollar kerak, bitta odamga 500 ming dollar kerak, birovga va hokazo. Lekin biz aytamiz,",yuz milliongacha qancha pul hisoblashsa kichkinagina odamga ikki yuz ming dollar kerak bitta xitoydan uskuna olib kelib yigirmata odamni ishlatish bitta odamga bir yuz ming dollar kerak bitta odamga besh yuz ming dollar kerak birovga va hokazo lekin biz aytamiz,yuz milliongacha qancha bular hisoblasa kichkinagina odamga ikki yuz ming dollar kerak bitta xitoydan uskuna olib kelib yigirmata odamni ishlatish bitta odamga yuz ming dollar kerak bitta odamga besh yuz ming dollar kerak birovga va hokazo lekin biz aytamiz,0.075,0.9421,19.632,"100 milliongacha, qancha bular hisoblasa. Kichkinagina odamga 200 ming dollar kerak, bitta Xitoydan uskuna olib kelib, 20 ta odamni ishlatish. Bitta odamga 100 ming dollar kerak, bitta odamga 500 ming dollar kerak, birovga va hokazo. Lekin biz aytamiz,"
2551,00020084.wav,"biz tomonga qarab bostirib kelayotgan qismi, ya'ni markazga tomon intilayotgan qismi hamda Yevro-Osiyo plitasining, demak, stigida to'qnashgan joyida Afg'oniston asosiy Hinduqush tog'lari eng ko'p har haftada haftasiga","biz tomonga qarab bostirib kelayotgan qismi, yaʼni markazga tomon intilayotgan qismi, hamda Yevroosiyo plitasining, demak, stigida toʻqnashgan joyida Afgʻoniston, asosiy Hinduqush togʻlari, eng koʻp har haftada, haftasiga",biz tomonga qarab bostirib kelayotgan qismi ya'ni markazga tomon intilayotgan qismi hamda yevro-osiyo plitasining demak stigida to'qnashgan joyida afg'oniston asosiy hinduqush tog'lari eng ko'p har haftada haftasiga,biz tomonga qarab bostirib kelayotgan qismi ya'ni markazga tomon intilayotgan qismi hamda yevroosiyo plitasining demak stigida to'qnashgan joyida afg'oniston asosiy hinduqush tog'lari eng ko'p har haftada haftasiga,0.037,0.9977,17.9786875,"biz tomonga qarab bostirib kelayotgan qismi, yaʼni markazga tomon intilayotgan qismi, hamda Yevrosiyo plitasining, demak, stigida toʻqnashgan joyida Afgʻoniston, asosiy Hinduqush togʻlari, eng koʻp har haftada, haftasiga"
2149,00016992.wav,"Masalan, pastga qursak, quyosh besh soat tushsa bu yerda, bemalol 10 soat quyosh tushadi. To quyosh chiqqanidan botguncha quyosh turadi bu yerda.","masalan pastga qursak, quyosh besh soat tushsa, bu yerda bemalol 10 soat quyosh tushadi. to quyosh chiqqandan botkungacha quyosh turadi bu yerda.",masalan pastga qursak quyosh besh soat tushsa bu yerda bemalol o'n soat quyosh tushadi to quyosh chiqqanidan botguncha quyosh turadi bu yerda,masalan pastga qursak quyosh besh soat tushsa bu yerda bemalol o'n soat quyosh tushadi to quyosh chiqqandan botkungacha quyosh turadi bu yerda,0.0909,0.9823,11.5893125,"Masalan, pastga qursak, quyosh besh soat tushsa bu yerda, bemalol 10 soat quyosh tushadi. To quyosh chiqqanidan botguncha quyosh turadi bu yerda."
2305,00018188.wav,"organlariga, albatta, bu soliq siri bilan bog'liq.","organlariga, albatta, bu davlat soliq siri bilan bog'liq",organlariga albatta bu soliq siri bilan bog'liq,organlariga albatta bu davlat soliq siri bilan bog'liq,0.1429,0.9307,7.4186875,"organlariga, albatta, bu soliq siri bilan bog'liq."
2536,00019998.wav,"biznesga juda yomon ta'sir qildi. Joy egalari arenda so'rayapti, xodimlarga oylik berish kerak, remontni boshlab qo'yganmiz, bu joydan qarzlarimiz bor, hamma muammo bitta paytga keldi. Eng predel nuqta qayerda bo'lgan?","biznesga juda yomon ta'sir qildi. Joy egalari arend so'rayapti, xodimlarga oylik berish kerak, remontni boshlab qo'yganmiz-a. Bu joydan qarzlarimiz bor, hamma muammo bitta paytga keldi. Eng predel nuqta qayerda bo'lgan?",biznesga juda yomon ta'sir qildi joy egalari arenda so'rayapti xodimlarga oylik berish kerak remontni boshlab qo'yganmiz bu joydan qarzlarimiz bor hamma muammo bitta paytga keldi eng predel nuqta qayerda bo'lgan,biznesga juda yomon ta'sir qildi joy egalari arend so'rayapti xodimlarga oylik berish kerak remontni boshlab qo'yganmiz-a bu joydan qarzlarimiz bor hamma muammo bitta paytga keldi eng predel nuqta qayerda bo'lgan,0.0667,0.9929,16.5706875,"biznesga juda yomon ta'sir qildi. Joy egalari arenda so'rayapti, xodimlarga oylik berish kerak, remontni boshlab qo'yganmiz, bu joydan qarzlarimiz-a bor, hamma muammo bitta paytga keldi. Eng predel nuqta qayerda bo'lgan?"
1933,00015370.wav,takliflarga misol uchun o'sha berilayotgan o'sha pul takliflariga kimdir misol o'sha tushunishim bo'yicha talabalar o'sha Moskvada ishlab ham o'qishadi. Bir gap bilan aytganda o'sha yetishmovchilikdan kelib chiqadi ko'p narsalar va uni o'sha aytaylik ba'zi bir shaxslar ana shu,"takliflarga, misol uchun oʻsha berilayotgan oʻsha pul takliflariga, kimdir misol oʻsha tushunishim boʻyicha talabalar oʻsha Moskvada ishlab ham oʻqishadi. Bir gap bilan aytganda oʻsha yetishmovchilikdan kelib chiqadi koʻp narsalar va uni shu aytaylik, baʼzi bir shaxslar ana shu",takliflarga misol uchun o'sha berilayotgan o'sha pul takliflariga kimdir misol o'sha tushunishim bo'yicha talabalar o'sha moskvada ishlab ham o'qishadi bir gap bilan aytganda o'sha yetishmovchilikdan kelib chiqadi ko'p narsalar va uni o'sha aytaylik ba'zi bir shaxslar ana shu,takliflarga misol uchun o'sha berilayotgan o'sha pul takliflariga kimdir misol o'sha tushunishim bo'yicha talabalar o'sha moskvada ishlab ham o'qishadi bir gap bilan aytganda o'sha yetishmovchilikdan kelib chiqadi ko'p narsalar va uni shu aytaylik ba'zi bir shaxslar ana shu,0.0263,0.9855,19.205375,takliflariga misol uchun o'sha berilayotgan o'sha pul takliflariga kimdir misol o'sha tushunishim bo'yicha talabalar o'sha Moskvada ishlab ham o'qishadi. Bir gap bilan aytganda o'sha yetishmovchilikdan kelib chiqadi ko'p narsalar va ana o'sha aytaylik ba'zi bir shaxslar ana shu
6,00000051.wav,"Hammasi, demak, murakkab bizneslar qilishadi-da. Misol uchun, mana Zafar aka misolida oladigan bo'lsak, unaqa biznes qilish uchun yaxshigina o'qish kerak-da.","hammasi demak murakkab bizneslar qilishadi-da. Misol uchun masalan Zafar aka misolida oladigan boʻlsak, unaqa biznes qilish uchun yaxshigina oʻqish kerak-da.",hammasi demak murakkab bizneslar qilishadi-da misol uchun mana zafar aka misolida oladigan bo'lsak unaqa biznes qilish uchun yaxshigina o'qish kerak-da,hammasi demak murakkab bizneslar qilishadi-da misol uchun masalan zafar aka misolida oladigan bo'lsak unaqa biznes qilish uchun yaxshigina o'qish kerak-da,0.05,0.9836,10.11,"Hammasi, demak, murakkab bizneslar qilishadi-da. Misol uchun, mana Zafar aka misolida oladigan bo'lsak, unaqa biznes qilish uchun yaxshigina o'qish kerak-da."
